link,title,description,Related Topics,Year
https://www.ted.com/talks/reshma_saujani_teach_girls_bravery_not_perfection?referrer=playlist-the_most_popular_talks_of_2016&autoplay=true,"Teach girls bravery, not perfection",No description found,"computers, software, education, innovation, social change, future, motivation, personal growth, potential, women, code, teaching, kids, equality",2016
https://www.ted.com/talks/brian_little_who_are_you_really_the_puzzle_of_personality?referrer=playlist-the_most_popular_talks_of_2016&autoplay=true,"Who are you, really? The puzzle of personality",No description found,"psychology, communication, self, humanity, humor, TED Books, identity, personality",2016
https://www.ted.com/talks/julia_galef_why_you_think_you_re_right_even_if_you_re_wrong?referrer=playlist-the_most_popular_talks_of_2016&autoplay=true,Why you think you're right -- even if you're wrong,No description found,"collaboration, communication, leadership, motivation, personal growth, decision-making, society, identity, TEDx",2016
https://www.ted.com/talks/shonda_rhimes_my_year_of_saying_yes_to_everything?referrer=playlist-the_most_popular_talks_of_2016&autoplay=true,My year of saying yes to everything,No description found,"culture, creativity, parenting, work, motivation, personal growth, decision-making, writing, family, identity, television, work-life balance, kids",2016
https://www.ted.com/talks/monica_lewinsky_the_price_of_shame?referrer=playlist-the_most_popular_talks_of_2015_1&autoplay=true,The price of shame,No description found,"technology, media, communication, suicide, social media",2015
https://www.ted.com/talks/esther_perel_rethinking_infidelity_a_talk_for_anyone_who_has_ever_loved?referrer=playlist-the_most_popular_talks_of_2015_1&autoplay=true,Rethinking infidelity ... a talk for anyone who has ever loved,No description found,"culture, love, relationships, sex",2015
https://www.ted.com/talks/johann_hari_everything_you_think_you_know_about_addiction_is_wrong?referrer=playlist-the_most_popular_talks_of_2015_1&autoplay=true,Everything you think you know about addiction is wrong,No description found,"culture, society, policy, addiction, drugs",2015
https://www.ted.com/talks/bel_pesce_5_ways_to_kill_your_dreams?referrer=playlist-the_most_popular_talks_of_2015_1&autoplay=true,5 ways to kill your dreams,No description found,"entrepreneur, innovation, TED Fellows",2015
https://www.ted.com/talks/greg_gage_how_to_control_someone_else_s_arm_with_your_brain?referrer=playlist-the_most_popular_talks_of_2015_1&autoplay=true,How to control someone else's arm with your brain,No description found,"science, technology, biotech, biology, demo, brain, TED Fellows, neuroscience, human body",2015
https://www.ted.com/talks/hannah_fry_the_mathematics_of_love?referrer=playlist-the_most_popular_talks_of_2015_1&autoplay=true,The mathematics of love,No description found,"love, relationships, statistics, math, TED Books, TEDx",2015
https://www.ted.com/talks/takaharu_tezuka_the_best_kindergarten_you_ve_ever_seen?referrer=playlist-the_most_popular_talks_of_2015_1&autoplay=true,The best kindergarten you’ve ever seen,No description found,"design, architecture, education, TEDx, youth, kids",2015
https://www.ted.com/talks/guy_winch_why_we_all_need_to_practice_emotional_first_aid?referrer=playlist-the_most_popular_talks_of_2015_1&autoplay=true,Why we all need to practice emotional first aid,No description found,"health, psychology, self, mental health, TEDx, mindfulness",2015
https://www.ted.com/talks/bj_miller_what_really_matters_at_the_end_of_life?referrer=playlist-the_most_popular_talks_of_2015_1&autoplay=true,What really matters at the end of life,No description found,"global issues, death, health, health care, medicine",2015
https://www.ted.com/talks/scott_dinsmore_how_to_find_work_you_love?referrer=playlist-the_most_popular_talks_of_2015_1&autoplay=true,How to find work you love,No description found,"business, entrepreneur, happiness, work, TEDx, work-life balance",2015
https://www.ted.com/talks/john_green_the_nerd_s_guide_to_learning_everything_online?referrer=playlist-the_most_popular_talks_of_2015_1&autoplay=true,The nerd's guide to learning everything online,No description found,"education, community, TEDx, Internet",2015
https://www.ted.com/talks/maysoon_zayid_i_got_99_problems_palsy_is_just_one?referrer=playlist-the_most_popular_talks_of_2014&autoplay=true,I got 99 problems ... palsy is just one,No description found,"entertainment, comedy, women, humor",2014
https://www.ted.com/talks/louie_schwartzberg_hidden_miracles_of_the_natural_world?referrer=playlist-the_most_popular_talks_of_2014&autoplay=true,Hidden miracles of the natural world,No description found,"nature, film, photography, insects, bacteria, nanotechnology",2014
https://www.ted.com/talks/julian_treasure_how_to_speak_so_that_people_want_to_listen?referrer=playlist-the_most_popular_talks_of_2014&autoplay=true,How to speak so that people want to listen,No description found,"culture, communication, sound",2014
https://www.ted.com/talks/hugh_herr_the_new_bionics_that_let_us_run_climb_and_dance?referrer=playlist-the_most_popular_talks_of_2014&autoplay=true,"The new bionics that let us run, climb and dance",No description found,"technology, dance, prosthetics, bionics",2014
https://www.ted.com/talks/simon_sinek_why_good_leaders_make_you_feel_safe?referrer=playlist-the_most_popular_talks_of_2014&autoplay=true,Why good leaders make you feel safe,No description found,"business, military, leadership, work",2014
https://www.ted.com/talks/ruth_chang_how_to_make_hard_choices?referrer=playlist-the_most_popular_talks_of_2014&autoplay=true,How to make hard choices,No description found,"philosophy, decision-making",2014
https://www.ted.com/talks/edward_snowden_here_s_how_we_take_back_the_internet?referrer=playlist-the_most_popular_talks_of_2014&autoplay=true,Here's how we take back the Internet,No description found,"law, Internet, journalism, surveillance, encryption",2014
https://www.ted.com/talks/sandra_aamodt_why_dieting_doesn_t_usually_work?referrer=playlist-the_most_popular_talks_of_2014&autoplay=true,Why dieting doesn't usually work,No description found,"health, neuroscience, mindfulness",2014
https://www.ted.com/talks/guy_hoffman_robots_with_soul?referrer=playlist-the_most_popular_talks_of_2014&autoplay=true,"Robots with ""soul""",No description found,"technology, entertainment, music, robots, AI, TEDx",2014
https://www.ted.com/talks/jamila_lyiscott_3_ways_to_speak_english?referrer=playlist-the_most_popular_talks_of_2014&autoplay=true,3 ways to speak English,No description found,"culture, race, language, spoken word",2014
https://www.ted.com/talks/geena_rocero_why_i_must_come_out?referrer=playlist-the_most_popular_talks_of_2014&autoplay=true,Why I must come out,No description found,"gender, activism, beauty, identity, fashion, Transgender, equality, LGBTQIA+",2014
